{
  "schema_version": "raw_evidence_v0.1",
  "case_id": "case01",
  "knowledge_type": "html",
  "question_text": "地方自治法第2条に基づき、町の事務の基本的な考え方を説明してください。",
  "answer_text_raw": "地方自治法第2条では、地方公共団体は住民の福祉の増進を図ることを基本として事務を処理する旨が定められています。",
  "answer_timestamp": "2025-12-17T11:00:00+09:00",
  "model_identifier": "qommons-ai-default",
  "test_run_id": "f4-v0.2-run-001"
}
